{
  "schemaVersion": "audit-controller-operation-pointer-v1",
  "processId": "audit-v7-independent-review",
  "requestId": "awr-e2e-canonical-v1",
  "controller": {
    "repository": "CurveYield2/Audit-Controller",
    "commit": "8c8ee4d3d9a8838e9d7e1abc4b72793d7b19bdde",
    "requestPath": ".deep-assurance/operator/requests/awr-e2e-canonical-v1.json"
  },
  "verifyController": true
}
