{
  "schemaVersion": "audit-controller-operation-pointer-v1",
  "processId": "audit-v7-independent-review",
  "requestId": "awr-final-evidence-index-e2e-v2",
  "controller": {
    "repository": "CurveYield2/Audit-Controller",
    "commit": "076fc7741621e912f7c80ad541b56775dd87cca5",
    "requestPath": ".deep-assurance/operator/requests/awr-final-evidence-index-e2e-v2.json"
  },
  "verifyController": true
}
