{
  "schemaVersion": "audit-controller-operation-pointer-v1",
  "processId": "audit-v7-independent-review",
  "requestId": "awr-runner-rebind-v1",
  "controller": {
    "repository": "CurveYield2/Audit-Controller",
    "commit": "404c08d1a5a4ae396051dc1b8560cf7ae592c624",
    "requestPath": ".deep-assurance/operator/requests/awr-runner-rebind-v1.json"
  },
  "verifyController": true
}
